# LogicTest: local

statement ok
create table test1(a int primary key, b int, c int);
insert into test1 values(1,2,4);
insert into test1 values(2, 3, 5) on duplicate key update c=test1.c+1;

query III colnames
select * from test1;
----
a  b  c
1  2  4
2  3  5

statement ok
insert into test1 values(1, 3, 5) on duplicate key update c=test1.c+1;

query III colnames
select * from test1;
----
a  b  c
1  2  5
2  3  5

statement ok
insert into test1 values(1, 5, 6) on duplicate key update c=test1.c+1,c=test1.c+2;

query III colnames
select * from test1;
----
a  b  c
1  2  8
2  3  5

statement ok
CREATE UNIQUE INDEX ON test1 (b);
insert into test1 values(1, 3, 5) on duplicate key update c=test1.c+2;

query III colnames
select * from test1;
----
a  b  c
1  2  10
2  3  5

statement ok
create table test2(a int primary key, b int, c int, d int);
CREATE UNIQUE INDEX ON test2 (b);
CREATE UNIQUE INDEX ON test2 (c);
insert into test2 values (1,2,3,4),(2,3,1,5),(3,1,2,6);
insert into test2 values(4,3,2,1) on duplicate key update d=test2.d+1;

query IIII colnames
select * from test2
----
a  b  c  d
1  2  3  4
2  3  1  6
3  1  2  6

statement ok
insert into test2 values(4,3,2,1) on duplicate key update d=abs(test2.c)+1;

query IIII colnames
select * from test2
----
a  b  c  d
1  2  3  4
2  3  1  2
3  1  2  6

statement ok
create table test3(a int, b int, c int);
insert into test3 values(1,2,4);
insert into test3 values(1,2,4) on duplicate key update c=test3.c+1;

query III colnames
select * from test3
----
a  b  c
1  2  4
1  2  4

statement ok
delete from test3 where 1=1;
CREATE UNIQUE INDEX ON test3 (a);
insert into test3(b,c) values(5,6) on duplicate key update c=test3.c+1;

query III colnames
select * from test3
----
a     b  c
NULL  5  6

statement ok
create table test4(a int, b int, c int);
CREATE UNIQUE INDEX ON test3 (a, b);
insert into test4(b,c) values(5,6) on duplicate key update c=test4.c+1;

query III colnames
select * from test4
----
 a     b  c
 NULL  5  6

statement error pq: 相同的键值 a=2 违反了主键约束 "primary"
insert into test2 values(5,6,7,8),(3,6,7,8) on duplicate key update a=test2.a-1;

statement error pq: 相同的键值 b=2 违反了唯一性约束 "test2_b_key"
insert into test2 values(5,3,7,8) on duplicate key update b=test2.b-1;